<?xml version="1.0" encoding="UTF-8"?>

<questionTree xmlns:xsi="http://www.w3.org/2001/XMLSchema-instance" xsi:noNamespaceSchemaLocation="animalTreeSchema.xsd">
    <node data="Are you a mammal?" >
        <left data="Are you bigger than a cat?" >
            <left data="Kangaroo" />
            <right data="Mouse" />
        </left>
        <right data="Do you live underwater?" >
            <left data="Trout" />
            <right data="Robin" />
        </right>
    </node>
</questionTree>

